{
  "scheme": "x401",
  "version": "0.2.0",
  "credential_requirements": {
    "digital": {
      "requests": [
        {
          "protocol": "openid4vp-v1-signed",
          "data": {
            "request": "eyJ..."
          }
        }
      ]
    }
  },
  "oauth": {
    "token_endpoint": "https://bank.example.com/oauth/token"
  },
  "return_uri": "https://mcp.example/x401/return/9f1c2a"
}
